	Foundational Skills	RF.K.1	Demonstrate understanding of the organization and basic features of print.
	Foundational Skills	RF.K.1.A	Follow words from left to right, top to bottom, and page by page.
	Foundational Skills	RF.K.1.B	Recognize that spoken words are represented in written language by specific sequences of letters.
	Foundational Skills	RF.K.1.C	Understand that words are separated by spaces in print.
	Foundational Skills	RF.K.1.D	Recognize and name all upper- and lowercase letters of the alphabet.
	Foundational Skills	RF.K.2	Demonstrate understanding of spoken words, syllables, and sounds (phonemes).
	Foundational Skills	RF.K.2.A	Recognize and produce rhyming words.
	Foundational Skills	RF.K.2.B	Count, pronounce, blend, and segment syllables in spoken words.
	Foundational Skills	RF.K.2.C	Blend and segment onsets and rimes of single-syllable spoken words.
	Foundational Skills	RF.K.2.D	Isolate and pronounce the initial, medial vowel, and final sounds (phonemes) in three-phoneme (consonant-vowel-consonant, or CVC) words.
	Foundational Skills	RF.K.2.E	Add or substitute individual sounds (phonemes) in simple, one-syllable words to make new words.
	Foundational Skills	RF.K.3	Know and apply grade-level phonics and word analysis skills in decoding words.
	Foundational Skills	RF.K.3.A	Demonstrate basic knowledge of one-to-one letter-sound correspondences by producing the primary sound or many of the most frequent sounds for each consonant.
	Foundational Skills	RF.K.3.B	Associate the long and short sounds with common spellings (graphemes) for the five major vowels.
	Foundational Skills	RF.K.3.C	Read common high-frequency words by sight (e.g., the, of, to, you, she, my, is, are, do, does).
	Foundational Skills	RF.K.3.D	Distinguish between similarly spelled words by identifying the sounds of the letters that differ.
	Foundational Skills	RF.K.4	Read emergent-reader texts with purpose and understanding.
	Foundational Skills	RF.1.1	Demonstrate understanding of the organization and basic features of print.
	Foundational Skills	RF.1.1.A	Recognize the distinguishing features of a sentence (e.g., first word, capitalization, ending punctuation).
	Foundational Skills	RF.1.2	Demonstrate understanding of spoken words, syllables, and sounds (phonemes).
	Foundational Skills	RF.1.2.A	Distinguish long from short vowel sounds in spoken single-syllable words.
	Foundational Skills	RF.1.2.B	Orally produce single-syllable words by blending sounds (phonemes), including consonant blends.
	Foundational Skills	RF.1.2.C	Isolate and pronounce initial, medial vowel, and final sounds (phonemes) in spoken single-syllable words.
	Foundational Skills	RF.1.2.D	Segment spoken single-syllable words into their complete sequence of individual sounds (phonemes).
	Foundational Skills	RF.1.3	Know and apply grade-level phonics and word analysis skills in decoding words.
	Foundational Skills	RF.1.3.A	Know the spelling-sound correspondences for common consonant digraphs.
	Foundational Skills	RF.1.3.B	Decode regularly spelled one-syllable words.
	Foundational Skills	RF.1.3.C	Know final -e and common vowel team conventions for representing long vowel sounds.
	Foundational Skills	RF.1.3.D	Use knowledge that every syllable must have a vowel sound to determine the number of syllables in a printed wor
	Foundational Skills	RF.1.3.E	Decode two-syllable words following basic patterns by breaking the words into syllables.
	Foundational Skills	RF.1.3.F	Read words with inflectional endings.
	Foundational Skills	RF.1.3.G	Recognize and read grade-appropriate irregularly spelled words.
	Foundational Skills	RF.1.4	Read with sufficient accuracy and fluency to support comprehension.
	Foundational Skills	RF.1.4.A	Read grade-level text with purpose and understanding.
	Foundational Skills	RF.1.4.B	Read grade-level text orally with accuracy, appropriate rate, and expression on successive readings.
	Foundational Skills	RF.1.4.C	Use context to confirm or self-correct word recognition and understanding, rereading as necessary.
	Foundational Skills	RF.2.3	Know and apply grade-level phonics and word analysis skills in decoding words.
	Foundational Skills	RF.2.3.A	Distinguish long and short vowels when reading regularly spelled one-syllable words.
	Foundational Skills	RF.2.3.B	Know spelling-sound correspondences for additional common vowel teams.
	Foundational Skills	RF.2.3.C	Decode regularly spelled two-syllable words with long vowels.
	Foundational Skills	RF.2.3.D	Decode words with common prefixes and suffixes.
	Foundational Skills	RF.2.3.E	Identify words with inconsistent but common spelling-sound correspondences.
	Foundational Skills	RF.2.3.F	Recognize and read grade-appropriate irregularly spelled words.
	Foundational Skills	RF.2.4	Read with sufficient accuracy and fluency to support comprehension.
	Foundational Skills	RF.2.4.A	Read grade-level text with purpose and understanding.
	Foundational Skills	RF.2.4.B	Read grade-level text orally with accuracy, appropriate rate, and expression on successive readings.
	Foundational Skills	RF.2.4.C	Use context to confirm or self-correct word recognition and understanding, rereading as necessary.
	Foundational Skills	RF.3.3	Know and apply grade-level phonics and word analysis skills in decoding words.
	Foundational Skills	RF.3.3.A	Identify and know the meaning of the most common prefixes and derivational suffixes.
	Foundational Skills	RF.3.3.B	Decode words with common Latin suffixes.
	Foundational Skills	RF.3.3.C	Decode multisyllable words.
	Foundational Skills	RF.3.3.D	Read grade-appropriate irregularly spelled words.
	Foundational Skills	RF.3.4	Read with sufficient accuracy and fluency to support comprehension.
	Foundational Skills	RF.3.4.A	Read grade-level text with purpose and understanding.
	Foundational Skills	RF.3.4.B	Read grade-level prose and poetry orally with accuracy, appropriate rate, and expression on successive readings
	Foundational Skills	RF.3.4.C	Use context to confirm or self-correct word recognition and understanding, rereading as necessary.
	Foundational Skills	RF.4.3	Know and apply grade-level phonics and word analysis skills in decoding words.
	Foundational Skills	RF.4.3.A	Use combined knowledge of all letter-sound correspondences, syllabication patterns, and morphology (e.g., roots and affixes) to read accurately unfamiliar multisyllabic words in context and out of context.
	Foundational Skills	RF.4.4	Read with sufficient accuracy and fluency to support comprehension.
	Foundational Skills	RF.4.4.A	Read grade-level text with purpose and understanding.
	Foundational Skills	RF.4.4.B	Read grade-level prose and poetry orally with accuracy, appropriate rate, and expression on successive readings.
	Foundational Skills	RF.4.4.C	Use context to confirm or self-correct word recognition and understanding, rereading as necessary.
	Foundational Skills	RF.5.3	Know and apply grade-level phonics and word analysis skills in decoding words.
	Foundational Skills	RF.5.3.A	Use combined knowledge of all letter-sound correspondences, syllabication patterns, and morphology (e.g., roots and affixes) to read accurately unfamiliar multisyllabic words in context and out of context.
	Foundational Skills	RF.5.4	Read with sufficient accuracy and fluency to support comprehension.
	Foundational Skills	RF.5.4.A	Read grade-level text with purpose and understanding.
	Foundational Skills	RF.5.4.B	Read grade-level prose and poetry orally with accuracy, appropriate rate, and expression on successive readings.
	Foundational Skills	RF.5.4.C	Use context to confirm or self-correct word recognition and understanding, rereading as necessary.
	Informational Text	RI.K.1	With prompting and support, ask and answer questions about key details in a text.
	Informational Text	RI.K.2	With prompting and support, identify the main topic and retell key details of a text.
	Informational Text	RI.K.3	With prompting and support, describe the connection between two individuals, events, ideas, or pieces of information in a text.
	Informational Text	RI.K.4	With prompting and support, ask and answer questions about unknown words in a text.
	Informational Text	RI.K.5	Identify the front cover, back cover, and title page of a book.
	Informational Text	RI.K.6	Name the author and illustrator of a text and define the role of each in presenting the ideas or information in a text.
	Informational Text	RI.K.7	With prompting and support, describe the relationship between illustrations and the text in which they appear.
	Informational Text	RI.K.8	With prompting and support, identify the reasons an author gives to support points in a text.
	Informational Text	RI.K.9	With prompting and support, identify basic similarities in and differences between two texts on the same topic.
	Informational Text	RI.K.10	Actively engage in group reading activities with purpose and understanding.
	Informational Text	RI.1.1	Ask and answer questions about key details in a text.
	Informational Text	RI.1.2	Identify the main topic and retell key details of a text.
	Informational Text	RI.1.3	Describe the connection between two individuals, events, ideas, or pieces of information in a text.
	Informational Text	RI.1.4	Ask and answer questions to help determine or clarify the meaning of words and phrases in a text.
	Informational Text	RI.1.5	Know and use various text features to locate key facts or information in a text.
	Informational Text	RI.1.6	Distinguish between information provided by pictures or other illustrations and information provided by the words in a text.
	Informational Text	RI.1.7	Use the illustrations and details in a text to describe its key ideas.
	Informational Text	RI.1.8	Identify the reasons an author gives to support points in a text.
	Informational Text	RI.1.9	Identify basic similarities in and differences between two texts on the same topic.
	Informational Text	RI.1.10	With prompting and support, read informational texts appropriately complex for grade
	Informational Text	RI.2.1	Ask and answer such questions as who, what, where, when, why, and how to demonstrate understanding of key details in a text.
	Informational Text	RI.2.2	Identify the main topic of a multiparagraph text as well as the focus of specific paragraphs within the text.
	Informational Text	RI.2.3	Describe the connection between a series of historical events, scientific ideas or concepts, or steps in technical procedures in a text.
	Informational Text	RI.2.4	Determine the meaning of words and phrases in a text relevant to a grade 2 topic or subject are
	Informational Text	RI.2.5	Know and use various text features to locate key facts or information in a text efficiently.
	Informational Text	RI.2.6	Identify the main purpose of a text, including what the author wants to answer, explain, or describe.
	Informational Text	RI.2.7	Explain how specific images contribute to and clarify a text.
	Informational Text	RI.2.8	Describe how reasons support specific points the author makes in a text.
	Informational Text	RI.2.9	Compare and contrast the most important points presented by two texts on the same topi
	Informational Text	RI.2.10	By the end of year, read and comprehend informational texts, including history/social studies, science, and technical texts, in the grades 2–3 text complexity band proficiently, with scaffolding as needed at the high end of the range.
	Informational Text	RI.3.1	Ask and answer questions to demonstrate understanding of a text, referring explicitly to the text as the basis for the answers.
	Informational Text	RI.3.2	Determine the main idea of a text; recount the key details and explain how they support the main ide
	Informational Text	RI.3.3	Describe the relationship between a series of historical events, scientific ideas or concepts, or steps in technical procedures in a text, using language that pertains to time, sequence, and cause/effect.
	Informational Text	RI.3.4	Determine the meaning of general academic and domain-specific words and phrases in a text relevant to a grade 3 topic or subject are
	Informational Text	RI.3.5	Use text features and search tools to locate information relevant to a given topic efficiently.
	Informational Text	RI.3.6	Distinguish their own point of view from that of the author of a text.
	Informational Text	RI.3.7	Use information gained from illustrations (e.g., maps, photographs) and the words in a text to demonstrate understanding of the text.
	Informational Text	RI.3.8	Describe the logical connection between particular sentences and paragraphs in a text.
	Informational Text	RI.3.9	Compare and contrast the most important points and key details presented in two texts on the same topi
	Informational Text	RI.3.10	By the end of the year, read and comprehend informational texts, including history/social studies, science, and technical texts, at the high end of the grades 2–3 text complexity band independently and proficiently.
	Informational Text	RI.4.1	Refer to details and examples in a text when explaining what the text says explicitly and when drawing inferences from the text.
	Informational Text	RI.4.2	Determine the main idea of a text and explain how it is supported by key details; summarize the text.
	Informational Text	RI.4.3	Explain events, procedures, ideas, or concepts in a historical, scientific, or technical text, including what happened and why, based on specific information in the text.
	Informational Text	RI.4.4	Determine the meaning of general academic and domain-specific words or phrases in a text relevant to a grade 4 topic or subject are
	Informational Text	RI.4.5	Describe the overall structure (e.g., chronology, comparison, cause/effect, problem/solution) of events, ideas, concepts, or information in a text or part of a text.
	Informational Text	RI.4.6	Compare and contrast a firsthand and secondhand account of the same event or topic; describe the differences in focus and the information provide.
	Informational Text	RI.4.7	Interpret information presented visually, orally, or quantitatively (e.g., in charts, graphs, diagrams, time lines, animations, or interactive elements on Web pages) and explain how the information contributes to an understanding of the text in which it appears.
	Informational Text	RI.4.8	Explain how an author uses reasons and evidence to support particular points in a text.
	Informational Text	RI.4.9	Integrate information from two texts on the same topic in order to write or speak about the subject knowledgeably.
	Informational Text	RI.4.10	By the end of year, read and comprehend informational texts, including history/social studies, science, and technical texts, in the grades 4–5 text complexity band proficiently, with scaffolding as needed at the high end of the range.
	Informational Text	RI.5.1	Quote accurately from a text when explaining what the text says explicitly and when drawing inferences from the text.
	Informational Text	RI.5.2	Determine two or more main ideas of a text and explain how they are supported by key details; summarize the text.
	Informational Text	RI.5.3	Explain the relationships or interactions between two or more individuals, events, ideas, or concepts in a historical, scientific, or technical text based on specific information in the text.
	Informational Text	RI.5.4	Determine the meaning of general academic and domain-specific words and phrases in a text relevant to a grade 5 topic or subject are
	Informational Text	RI.5.5	Compare and contrast the overall structure (e.g., chronology, comparison, cause/effect, problem/solution) of events, ideas, concepts, or information in two or more texts.
	Informational Text	RI.5.6	Analyze multiple accounts of the same event or topic, noting important similarities and differences in the point of view they represent.
	Informational Text	RI.5.7	Draw on information from multiple print or digital sources, demonstrating the ability to locate an answer to a question quickly or to solve a problem efficiently.
	Informational Text	RI.5.8	Explain how an author uses reasons and evidence to support particular points in a text, identifying which reasons and evidence support which point(s).
	Informational Text	RI.5.9	Integrate information from several texts on the same topic in order to write or speak about the subject knowledgeably.
	Informational Text	RI.5.10	By the end of the year, read and comprehend informational texts, including history/social studies, science, and technical texts, at the high end of the grades 4–5 text complexity band independently and proficiently.
	Informational Text	RI.6.1	Cite textual evidence to support analysis of what the text says explicitly as well as inferences drawn from the text.
	Informational Text	RI.6.2	Determine a central idea of a text and how it is conveyed through particular details; provide a summary of the text distinct from personal opinions or judgments.
	Informational Text	RI.6.3	Analyze in detail how a key individual, event, or idea is introduced, illustrated, and elaborated in a text (e.g., through examples or anecdotes).
	Informational Text	RI.6.4	Determine the meaning of words and phrases as they are used in a text, including figurative, connotative, and technical meanings.
	Informational Text	RI.6.5	Analyze how a particular sentence, paragraph, chapter, or section fits into the overall structure of a text and contributes to the development of the ideas.
	Informational Text	RI.6.6	Determine an author’s point of view or purpose in a text and explain how it is conveyed in the text.
	Informational Text	RI.6.7	Integrate information presented in different media or formats (e.g., visually, quantitatively) as well as in words to develop a coherent understanding of a topic or issue.
	Informational Text	RI.6.8	Trace and evaluate the argument and specific claims in a text, distinguishing claims that are supported by reasons and evidence from claims that are not.
	Informational Text	RI.6.9	Compare and contrast one author’s presentation of events with that of another.
	Informational Text	RI.6.10	By the end of the year, read and comprehend literary nonfiction in the grades 6–8 text complexity band proficiently, with scaffolding as needed at the high end of the range.
	Informational Text	RI.7.1	Cite several pieces of textual evidence to support analysis of what the text says explicitly as well as inferences drawn from the text.
	Informational Text	RI.7.2	Determine two or more central ideas in a text and analyze their development over the course of the text; provide an objective summary of the text.
	Informational Text	RI.7.3	Analyze the interactions between individuals, events, and ideas in a text.
	Informational Text	RI.7.4	Determine the meaning of words and phrases as they are used in a text, including figurative, connotative, and technical meanings; analyze the impact of a specific word choice on meaning and tone.
	Informational Text	RI.7.5	Analyze the structure an author uses to organize a text, including how the major sections contribute to the whole and to the development of the ideas.
	Informational Text	RI.7.6	Determine an author’s point of view or purpose in a text and analyze how the author distinguishes his or her position from that of others.
	Informational Text	RI.7.7	Compare and contrast a text to an audio, video, or multimedia version of the text, analyzing each medium’s portrayal of the subject (e.g., how the delivery of a speech affects the impact of the words).
	Informational Text	RI.7.8	Trace and evaluate the argument and specific claims in a text, assessing whether the reasoning is sound and the evidence is relevant and sufficient to support the claims.
	Informational Text	RI.7.9	Analyze how two or more authors writing about the same topic shape their presentations of key information by emphasizing different evidence or advancing different interpretations of facts.
	Informational Text	RI.7.10	By the end of the year, read and comprehend literary nonfiction in the grades 6–8 text complexity band proficiently, with scaffolding as needed at the high end of the range.
	Informational Text	RI.8.1	Cite the textual evidence that most strongly supports an analysis of what the text says explicitly as well as inferences drawn from the text.
	Informational Text	RI.8.2	Determine a central idea of a text and analyze its development over the course of the text, including its relationship to supporting ideas; provide an objective summary of the text.
	Informational Text	RI.8.3	Analyze how a text makes connections among and distinctions between individuals, ideas, or events (e.g., through comparisons, analogies, or categories).
	Informational Text	RI.8.4	Determine the meaning of words and phrases as they are used in a text, including figurative, connotative, and technical meanings; analyze the impact of specific word choices on meaning and tone, including analogies or allusions to other texts.
	Informational Text	RI.8.5	Analyze in detail the structure of a specific paragraph in a text, including the role of particular sentences in developing and refining a key concept.
	Informational Text	RI.8.6	Determine an author’s point of view or purpose in a text and analyze how the author acknowledges and responds to conflicting evidence or viewpoints.
	Informational Text	RI.8.7	Evaluate the advantages and disadvantages of using different mediums (e.g., print or digital text, video, multimedia) to present a particular topic or ide
	Informational Text	RI.8.8	Delineate and evaluate the argument and specific claims in a text, assessing whether the reasoning is sound and the evidence is relevant and sufficient; recognize when irrelevant evidence is introduce
	Informational Text	RI.8.9	Analyze a case in which two or more texts provide conflicting information on the same topic and identify where the texts disagree on matters of fact or interpretation.
	Informational Text	RI.8.10	By the end of the year, read and comprehend literary nonfiction at the high end of the grades 6–8 text complexity band independently and proficiently. recognize when irrelevant evidence is introduce
	Informational Text	RI.9.1	Analyze seminal U.S. documents of historical and literary significance, including how they address related themes and concepts.
	Informational Text	RI.9.2	Determine a central idea of a text and analyze its development over the course of the text, including how it emerges and is shaped and refined by specific details; provide an objective summary of the text.
	Informational Text	RI.9.3	Analyze how the author unfolds an analysis or series of ideas or events, including the order in which the points are made, how they are introduced and developed, and the connections that are drawn between them.
	Informational Text	RI.9.4	Determine the meaning of words and phrases as they are used in a text, including figurative, connotative, and technical meanings; analyze the cumulative impact of specific word choices on meaning and tone (e.g., how the language of a court opinion differs from that of a newspaper).
	Informational Text	RI.9.5	Analyze in detail how an author’s ideas or claims are developed and refined by particular sentences, paragraphs, or larger portions of a text.
	Informational Text	RI.9.6	Determine an author’s point of view or purpose in a text and analyze how an author uses rhetoric to advance that point of view or purpose.
	Informational Text	RI.9.7	Analyze various accounts of a subject told in different mediums, determining which details are emphasized in each account.
	Informational Text	RI.9.8	Delineate and evaluate the argument and specific claims in a text, assessing whether the reasoning is valid and the evidence is relevant and sufficient; identify false statements and fallacious reasoning.
	Informational Text	RI.9.9	Analyze seminal U.S. documents of historical and literary significance, including how they address related themes and concepts.
	Informational Text	RI.9.10	By the end of grade 9, read and comprehend literary nonfiction in the grades 9–10 text complexity band proficiently, with scaffolding as needed at the high end of the range.
	Informational Text	RI.10.10	By the end of grade 10, read and comprehend literary nonfiction at the high end of the grades 9–10 text complexity band independently and proficiently.
	Informational Text	RI.11.1	Cite strong and thorough textual evidence to support analysis of what the text says explicitly as well as inferences drawn from the text, including determining where the text leaves matters uncertain.
	Informational Text	RI.11.2	Determine two or more central ideas of a text and analyze their development over the course of the text, including how they interact and build on one another to provide a complex analysis; provide an objective summary of the text.
	Informational Text	RI.11.3	Analyze a complex set of ideas or sequence of events and explain how specific individuals, ideas, or events interact and develop over the course of the text.
	Informational Text	RI.11.4	Determine the meaning of words and phrases as they are used in a text, including figurative, connotative, and technical meanings; analyze how an author uses and refines the meaning of a key term or terms over the course of a text (e.g., how Madison defines faction in Federalist No. 10).
	Informational Text	RI.11.5	Analyze and evaluate the effectiveness of the structure an author uses in his or her exposition or argument, including whether the structure makes points clear, convincing, and engaging.
	Informational Text	RI.11.6	Determine an author’s point of view or purpose in a text in which the rhetoric is particularly effective, analyzing how style and content contribute to the power, persuasiveness, or beauty of the text.
	Informational Text	RI.11.7	Integrate and evaluate multiple sources of information presented in different media or formats as well as in words in order to address a question or solve a problem.
