	Informational Text	RI.11.8	Delineate and evaluate the reasoning in seminal U.S. texts, including the application of constitutional principles and use of legal reasoning and the premises, purposes, and arguments in works of public advocacy.
	Informational Text	RI.11.9	Analyze seventeenth-, eighteenth-, and nineteenth-century foundational U.S. documents of historical and literary significance for their themes, purposes, and rhetorical features.
	Informational Text	RI.11.10	By the end of grade 11, read and comprehend literary nonfiction in the grades 11–CCR text complexity band proficiently, with scaffolding as needed at the high end of the range.
	Informational Text	RI.12.10	By the end of grade 12, read and comprehend literary nonfiction at the high end of the grades 11–CCR text complexity band independently and proficiently.
	Language	L.K.1	Demonstrate command of the conventions of standard English grammar and usage when writing or speaking.
	Language	L.K.1.A	Print many upper- and lowercase letters.
	Language	L.K.1.B	Use frequently occurring nouns and verbs.
	Language	L.K.1.C	Form regular plural nouns orally by adding /s/ or /es/ (e.g., dog, dogs; wish, wishes).
	Language	L.K.1.D	Understand and use question words (interrogatives) (e.g., who, what, where, when, why, how).
	Language	L.K.1.E	Use the most frequently occurring prepositions (e.g., to, from, in, out, on, off, for, of, by, with).
	Language	L.K.1.F	Produce and expand complete sentences in shared language activities.
	Language	L.K.2	Demonstrate command of the conventions of standard English capitalization, punctuation, and spelling when writing.
	Language	L.K.2.A	Capitalize the first word in a sentence and the pronoun
	Language	L.K.2.B	Recognize and name end punctuation.
	Language	L.K.2.C	Write a letter or letters for most consonant and short-vowel sounds (phonemes).
	Language	L.K.2.D	Spell simple words phonetically, drawing on knowledge of sound-letter relationships.
	Language	L.K.4	Determine or clarify the meaning of unknown and multiple-meaning words and phrases based on kindergarten reading and content.
	Language	L.K.4.A	Identify new meanings for familiar words and apply them accurately (e.g., knowing duck is a bird and learning the verb to duck).
	Language	L.K.4.B	Use the most frequently occurring inflections and affixes as a clue to the meaning of an unknown word.
	Language	L.K.5	With guidance and support from adults, explore word relationships and nuances in word meanings.
	Language	L.K.5.A	Sort common objects into categories to gain a sense of the concepts the categories represent.
	Language	L.K.5.B	Demonstrate understanding of frequently occurring verbs and adjectives by relating them to their opposites (antonyms).
	Language	L.K.5.C	Identify real-life connections between words and their use.
	Language	L.K.5.D	Distinguish shades of meaning among verbs describing the same general action by acting out the meanings.
	Language	L.K.6	Use words and phrases acquired through conversations, reading and being read to, and responding to texts.
	Language	L.1.1	Demonstrate command of the conventions of standard English grammar and usage when writing or speaking.
	Language	L.1.1.A	Print all upper- and lowercase letters.
	Language	L.1.1.B	Use common, proper, and possessive nouns.
	Language	L.1.1.C	Use singular and plural nouns with matching verbs in basic sentences.
	Language	L.1.1.D	Use personal, possessive, and indefinite pronouns.
	Language	L.1.1.E	Use verbs to convey a sense of past, present, and future.
	Language	L.1.1.F	Use frequently occurring adjectives.
	Language	L.1.1.G	Use frequently occurring conjunctions (e.g., and, but, or, so, because).
	Language	L.1.1.H	Use determiners (e.g., articles, demonstratives).
	Language	L.1.1.I	Use frequently occurring prepositions (e.g., during, beyond, toward).
	Language	L.1.1.J	Produce and expand complete simple and compound declarative, interrogative, imperative, and exclamatory sentences in response to prompts.
	Language	L.1.2	Demonstrate command of the conventions of standard English capitalization, punctuation, and spelling when writing.
	Language	L.1.2.A	Capitalize dates and names of people.
	Language	L.1.2.B	Use end punctuation for sentences.
	Language	L.1.2.C	Use commas in dates and to separate single words in a series.
	Language	L.1.2.D	Use conventional spelling for words with common spelling patterns and for frequently occurring irregular words.
	Language	L.1.2.E	Spell untaught words phonetically, drawing on phonemic awareness and spelling conventions.
	Language	L.1.4	Determine or clarify the meaning of unknown and multiple-meaning words and phrases based on grade 1 reading and content, choosing flexibly from an array of strategies.
	Language	L.1.4.A	Use sentence-level context as a clue to the meaning of a word or phrase.
	Language	L.1.4.B	Use frequently occurring affixes as a clue to the meaning of a wor
	Language	L.1.4.C	Identify frequently occurring root words (e.g., look) and their inflectional forms (e.g., looks, looked, looking).
	Language	L.1.5	With guidance and support from adults, demonstrate understanding of word relationships and nuances in word meanings.
	Language	L.1.5.A	Sort words into categories (e.g., colors, clothing) to gain a sense of the concepts the categories represent.
	Language	L.1.5.B	Define words by category and by one or more key attributes (e.g., a duck is a bird that swims; a tiger is a large cat with stripes).
	Language	L.1.5.C	Identify real-life connections between words and their use (e.g., note places at home that are cozy).
	Language	L.1.5.D	Distinguish shades of meaning among verbs differing in manner (e.g., look, peek, glance, stare, glare, scowl) and adjectives differing in intensity (e.g., large, gigantic) by defining or choosing them or by acting out the meanings.
	Language	L.1.6	Use words and phrases acquired through conversations, reading and being read to, and responding to texts, including using frequently occurring conjunctions to signal simple relationships (e.g., because).
	Language	L.2.1	Demonstrate command of the conventions of standard English grammar and usage when writing or speaking.
	Language	L.2.1.A	Use collective nouns (e.g., group).
	Language	L.2.1.B	Form and use frequently occurring irregular plural nouns (e.g., feet, children, teeth, mice, fish).
	Language	L.2.1.C	Use reflexive pronouns (e.g., myself, ourselves). Form and use the past tense of frequently
	Language	L.2.1.D	occurring irregular verbs (e.g., sat, hid, told). e. Use adjectives and adverbs, and choose
	Language	L.2.1.E	between them depending on what is to be modifie
	Language	L.2.1.F	Produce, expand, and rearrange complete simple and compound sentences (e.g., The boy watched the movie; The little boy watched the movie; The action movie was watched by the little boy).
	Language	L.2.2	Demonstrate command of the conventions of standard English capitalization, punctuation, and spelling when writing.
	Language	L.2.2.A	Capitalize holidays, product names, and geographic names.
	Language	L.2.2.B	Use commas in greetings and closings of letters.
	Language	L.2.2.C	Use an apostrophe to form contractions and frequently occurring possessives.
	Language	L.2.2.D	Generalize learned spelling patterns when writing words (e.g., cage → badge; boy → boil).
	Language	L.2.2.E	Consult reference materials, including beginning dictionaries, as needed to check and correct spellings.
	Language	L.2.3	Use knowledge of language and its conventions when writing, speaking, reading, or listening.
	Language	L.2.3.A	Compare formal and informal uses of Englis
	Language	L.2.4	Determine or clarify the meaning of unknown and multiple-meaning words and phrases based on grade 2 reading and content, choosing flexibly from an array of strategies.
	Language	L.2.4.A	Use sentence-level context as a clue to the meaning of a word or phrase.
	Language	L.2.4.B	Determine the meaning of the new word formed when a known prefix is added to a known word (e.g., happy/unhappy, tell/retell).
	Language	L.2.4.C	Use a known root word as a clue to the meaning of an unknown word with the same root (e.g., addition, additional).
	Language	L.2.4.D	Use knowledge of the meaning of individual words to predict the meaning of compound words (e.g., birdhouse, lighthouse, housefly; bookshelf, notebook, bookmark).
	Language	L.2.4.E	e. Use glossaries and beginning dictionaries, both print and digital, to determine or clarify the meaning of words and phrases.
	Language	L.2.5	Demonstrate understanding of word relationships and nuances in word meanings.
	Language	L.2.5.A	Identify real-life connections between words and their use (e.g., describe foods that are spicy or juicy).
	Language	L.2.5.B	Distinguish shades of meaning among closely related verbs (e.g., toss, throw, hurl) and closely related adjectives (e.g., thin, slender, skinny, scrawny).
	Language	L.2.6	Use words and phrases acquired through conversations, reading and being read to, and responding to texts, including using adjectives and adverbs to describe (e.g., When other kids are happy that makes me happy).
	Language	L.3.1	Demonstrate command of the conventions of standard English grammar and usage when writing or speaking.
	Language	L.3.1.A	Explain the function of nouns, pronouns, verbs, adjectives, and adverbs in general and their functions in particular sentences.
	Language	L.3.1.B	Form and use regular and irregular plural nouns.
	Language	L.3.1.C	Use abstract nouns (e.g., childhood).
	Language	L.3.1.D	Form and use regular and irregular verbs.
	Language	L.3.1.E	Form and use the simple (e.g., I walked; I walk; I will walk) verb tenses.
	Language	L.3.1.F	Ensure subject-verb and pronoun-antecedent agreement.*
	Language	L.3.1.G	Form and use comparative and superlative adjectives and adverbs, and choose between them depending on what is to be modifie
	Language	L.3.1.H	Use coordinating and subordinating conjunctions.
	Language	L.3.1.I	Produce simple, compound, and complex sentences.
	Language	L.3.2	Demonstrate command of the conventions of standard English capitalization, punctuation, and spelling when writing.
	Language	L.3.2.A	Capitalize appropriate words in titles.
	Language	L.3.2.B	Use commas in addresses.
	Language	L.3.2.C	Use commas and quotation marks in dialogue.
	Language	L.3.2.D	Form and use possessives.
	Language	L.3.2.E	Use conventional spelling for high-frequency and other studied words and for adding suffixes to base words (e.g., sitting, smiled, cries, happiness).
	Language	L.3.2.F	Use spelling patterns and generalizations (e.g., word families, position-based spellings, syllable patterns, ending rules, meaningful word parts) in writing words.
	Language	L.3.2.G	Consult reference materials, including beginning dictionaries, as needed to check and correct spellings.
	Language	L.3.3	Use knowledge of language and its conventions when writing, speaking, reading, or listening.
	Language	L.3.3.A	Choose words and phrases for effect.*
	Language	L.3.3.B	Recognize and observe differences between the conventions of spoken and written standard Englis
	Language	L.3.4	Determine or clarify the meaning of unknown and multiple-meaning word and phrases based on grade 3 reading and content, choosing flexibly from a range of strategies.
	Language	L.3.4.A	Use sentence-level context as a clue to the meaning of a word or phrase.
	Language	L.3.4.B	Determine the meaning of the new word formed when a known affix is added to a known word (e.g., agreeable/disagreeable, comfortable/uncomfortable, care/careless, heat/preheat).
	Language	L.3.4.C	Use a known root word as a clue to the meaning of an unknown word with the same root (e.g., company, companion).
	Language	L.3.4.D	Use glossaries or beginning dictionaries, both print and digital, to determine or clarify the precise meaning of key words and phrases.
	Language	L.3.5	Demonstrate understanding of word relationships and nuances in word meanings.
	Language	L.3.5.A	Distinguish the literal and nonliteral meanings of words and phrases in context (e.g., take steps).
	Language	L.3.5.B	Identify real-life connections between words and their use (e.g., describe people who are friendly or helpful).
	Language	L.3.5.C	Distinguish shades of meaning among related words that describe states of mind or degrees of certainty.
	Language	L.3.6	Acquire and use accurately grade-appropriate conversational, general academic, and domain- specific words and phrases, including those that signal spatial and temporal relationships (e.g., After dinner that night we went looking for them).
	Language	L.4.1	Demonstrate command of the conventions of standard English grammar and usage when writing or speaking.
	Language	L.4.1.A	Use relative pronouns (who, whose, whom, which, that) and relative adverbs (where, when, why).
	Language	L.4.1.B	Form and use the progressive (e.g., I was walking; I am walking; I will be walking) verb tenses.
	Language	L.4.1.C	Use modal auxiliaries (e.g., can, may, must) to convey various conditions.
	Language	L.4.1.D	Order adjectives within sentences according to conventional patterns (e.g., a small red bag rather than a red small bag).
	Language	L.4.1.E	Form and use prepositional phrases.
	Language	L.4.1.F	Produce complete sentences, recognizing and correcting inappropriate fragments and run-ons.*
	Language	L.4.1.G	Correctly use frequently confused words (e.g., to, too, two; there, their).*
	Language	L.4.2	Demonstrate command of the conventions of standard English capitalization, punctuation, and spelling when writing.
	Language	L.4.2.A	Use correct capitalization.
	Language	L.4.2.B	Use commas and quotation marks to mark direct speech and quotations from a text.
	Language	L.4.2.C	Use a comma before a coordinating conjunction in a compound sentence.
	Language	L.4.2.D	Spell grade-appropriate words correctly, consulting references as neede
	Language	L.4.3	Use knowledge of language and its conventions when writing, speaking, reading, or listening.
	Language	L.4.3.A	Choose words and phrases to convey ideas precisely.*
	Language	L.4.3.B	Choose punctuation for effect.*
	Language	L.4.3.C	Differentiate between contexts that call for formal English and situations where informal discourse is appropriate.
	Language	L.4.4	Determine or clarify the meaning of unknown and multiple-meaning words and phrases based on grade 4 reading and content, choosing flexibly from a range of strategies.
	Language	L.4.4.A	Use context as a clue to the meaning of a word or phrase.
	Language	L.4.4.B	Use common, grade-appropriate Greek and Latin affixes and roots as clues to the meaning of a word.
	Language	L.4.4.C	Consult reference materials, both print and digital, to find the pronunciation and determine or clarify the precise meaning of key words and phrases.
	Language	L.4.5	Demonstrate understanding of figurative language, word relationships, and nuances in word meanings.
	Language	L.4.5.A	Explain the meaning of simple similes and metaphors in context.
	Language	L.4.5.B	Recognize and explain the meaning of common idioms, adages, and proverbs.
	Language	L.4.5.C	Demonstrate understanding of words by relating them to their opposites (antonyms) and to words with similar but not identical meanings (synonyms).
	Language	L.4.6	Acquire and use accurately grade-appropriate general academic and domain-specific words and phrases, including those that signal precise actions, emotions, or states of being and that are basic to a particular topic (e.g., wildlife, conservation, and endangered when discussing animal preservation).
	Language	L.5.1	Demonstrate command of the conventions of standard English grammar and usage when writing or speaking.
	Language	L.5.1.A	Explain the function of conjunctions, prepositions, and interjections in general and their function in particular sentences.
	Language	L.5.1.B	Form and use the perfect (e.g., I had walked; I have walked; I will have walked) verb tenses.
	Language	L.5.1.C	Use verb tense to convey various times, sequences, states, and conditions.
	Language	L.5.1.D	Recognize and correct inappropriate shifts in verb tense.*
	Language	L.5.1.E	Use correlative conjunctions (e.g., either/or, neither/nor).
	Language	L.5.2	Demonstrate command of the conventions of standard English capitalization, punctuation, and spelling when writing.
	Language	L.5.2.A	Use punctuation to separate items in a series.*
	Language	L.5.2.B	Use a comma to separate an introductory element from the rest of the sentence.
	Language	L.5.2.C	Use a comma to set off the words yes and no, to set off a tag question from the rest of the sentence, and to indicate direct address.
	Language	L.5.2.D	Use underlining, quotation marks, or italics to indicate titles of works.
	Language	L.5.2.E	Spell grade-appropriate words correctly, consulting references as neede
	Language	L.5.3	Use knowledge of language and its conventions when writing, speaking, reading, or listening.
	Language	L.5.3.A	Expand, combine, and reduce sentences for meaning, reader/listener interest, and style.
	Language	L.5.3.B	Compare and contrast the varieties of English used in stories, dramas, or poems.
	Language	L.5.4	Determine or clarify the meaning of unknown and multiple-meaning words and phrases based on grade 5 reading and content, choosing flexibly from a range of strategies.
	Language	L.5.4.A	Use context as a clue to the meaning of a word or phrase.
	Language	L.5.4.B	Use common, grade-appropriate Greek and Latin affixes and roots as clues to the meaning of a word (e.g., photograph, photosynthesis).
	Language	L.5.4.C	Consult reference materials, both print and digital, to find the pronunciation and determine or clarify the precise meaning of key words and phrases.
	Language	L.5.5	Demonstrate understanding of figurative language, word relationships, and nuances in word meanings.
	Language	L.5.5.A	Interpret figurative language, including similes and metaphors, in context.
	Language	L.5.5.B	Recognize and explain the meaning of common idioms, adages, and proverbs.
	Language	L.5.5.C	Use the relationship between particular words (e.g., synonyms, antonyms, homographs) to better understand each of the words.
	Language	L.5.6	Acquire and use accurately grade-appropriate general academic and domain-specific words and phrases, including those that signal contrast, addition, and other logical relationships (e.g., however, although, nevertheless, similarly, moreover, in addition).
	Language	L.6.1	Demonstrate command of the conventions of standard English grammar and usage when writing or speaking.
	Language	L.6.1.A	Ensure that pronouns are in the proper case (subjective, objective, possessive).
	Language	L.6.1.B	Use intensive pronouns (e.g., myself, ourselves).
	Language	L.6.1.C	Recognize and correct inappropriate shifts in pronoun number and person.*
	Language	L.6.1.D	Recognize and correct vague pronouns (e., ones with unclear or ambiguous antecedents).*
	Language	L.6.1.E	Recognize variations from standard English in their own and others’ writing and speaking, and identify and use strategies to improve expression in conventional language.*
	Language	L.6.2	Demonstrate command of the conventions of standard English capitalization, punctuation, and spelling when writing.
	Language	L.6.2.A	Use punctuation (commas, parentheses, dashes) to set off nonrestrictive/parenthetical elements.*
	Language	L.6.2.B	Spell correctly.
	Language	L.6.3	Use knowledge of language and its conventions when writing, speaking, reading, or listening.
	Language	L.6.3.A	Vary sentence patterns for meaning, reader/ listener interest, and style.*
	Language	L.6.3.B	Maintain consistency in style and tone.*
	Language	L.6.4	Determine or clarify the meaning of unknown and multiple-meaning words and phrases based on grade 6 reading and content, choosing flexibly from a range of strategies.
	Language	L.6.4.A	Use context as a clue to the meaning of a word or phrase.
	Language	L.6.4.B	Use common, grade-appropriate Greek or Latin affixes and roots as clues to the meaning of a word.
	Language	L.6.4.C	Consult reference materials, both print and digital, to find the pronunciation of a word or determine or clarify its precise meaning or its part of speech.
	Language	L.6.4.D	Verify the preliminary determination of the meaning of a word or phrase.
	Language	L.6.5	Demonstrate understanding of figurative language, word relationships, and nuances in word meanings.
	Language	L.6.5.A	Interpret figures of speech in context.
	Language	L.6.5.B	Use the relationship between particular words to better understand each of the words.
	Language	L.6.5.C	Distinguish among the connotations (associations) of words with similar denotations (definitions).
	Language	L.6.6	Acquire and use accurately grade-appropriate general academic and domain-specific words and phrases; gather vocabulary knowledge when considering a word or phrase important to comprehension or expression.
	Language	L.7.1	Demonstrate command of the conventions of standard English grammar and usage when writing or speaking.
	Language	L.7.1.A	Explain the function of phrases and clauses in general and their function in specific sentences.
	Language	L.7.1.B	Choose among simple, compound, complex, and compound-complex sentences to signal differing relationships among ideas.
	Language	L.7.1.C	Place phrases and clauses within a sentence, recognizing and correcting misplaced and dangling modifiers.*
	Language	L.7.2	Demonstrate command of the conventions of standard English capitalization, punctuation, and spelling when writing.
	Language	L.7.2.A	Use a comma to separate coordinate adjectives.
	Language	L.7.2.B	Spell correctly.
	Language	L.7.3	Use knowledge of language and its conventions when writing, speaking, reading, or listening.
	Language	L.7.3.A	Choose language that expresses ideas precisely and concisely, recognizing and eliminating wordiness and redundancy.*
	Language	L.7.4	Determine or clarify the meaning of unknown and multiple-meaning words and phrases based on grade 7 reading and content, choosing flexibly from a range of strategies.
	Language	L.7.4.A	Use context as a clue to the meaning of a word or phrase.
	Language	L.7.4.B	Use common, grade-appropriate Greek or Latin affixes and roots as clues to the meaning of a word.
	Language	L.7.4.C	Consult general and specialized reference materials, both print and digital, to find the pronunciation of a word or determine or clarify its precise meaning or its part of speech.
	Language	L.7.4.D	Verify the preliminary determination of the meaning of a word or phrase (e.g., by checking the inferred meaning in context or in a dictionary).
	Language	L.7.5	Demonstrate understanding of figurative language, word relationships, and nuances in word meanings.
	Language	L.7.5.A	Interpret figures of speech in context.
	Language	L.7.5.B	Use the relationship between particular words to better understand each of the words.
	Language	L.7.5.C	Distinguish among the connotations (associations) of words with similar denotations (definitions).
	Language	L.7.6	Acquire and use accurately grade-appropriate general academic and domain-specific words and phrases; gather vocabulary knowledge when considering a word or phrase important to comprehension or expression.
	Language	L.8.1	Demonstrate command of the conventions of standard English grammar and usage when writing or speaking.
	Language	L.8.1.A	Explain the function of verbals (gerunds, participles, infinitives) in general and their function in particular sentences.
	Language	L.8.1.B	Form and use verbs in the active and passive voice.
	Language	L.8.1.C	Form and use verbs in the indicative, imperative, interrogative, conditional, and subjunctive moo
	Language	L.8.1.D	Recognize and correct inappropriate shifts in verb voice and mood.
	Language	L.8.2	Demonstrate command of the conventions of standard English capitalization, punctuation, and spelling when writing.
	Language	L.8.2.A	Use punctuation (comma, ellipsis, dash) to indicate a pause or break.
	Language	L.8.2.B	Use an ellipsis to indicate an omission.
	Language	L.8.2.C	Spell correctly.
	Language	L.8.3	Use knowledge of language and its conventions when writing, speaking, reading, or listening.
	Language	L.8.3.A	Use verbs in the active and passive voice and in the conditional and subjunctive mood to achieve particular effects.
	Language	L.8.4	Determine or clarify the meaning of unknown and multiple-meaning words or phrases based on grade 8 reading and content, choosing flexibly from a range of strategies.
	Language	L.8.4.A	Use contextas a clue to the meaning of a word or phrase.
	Language	L.8.4.B	Use common, grade-appropriate Greek or Latin affixes and roots as clues to the meaning of a word.
	Language	L.8.4.C	Consult general and specialized reference materials, both print and digital, to find the pronunciation of a word or determine or clarify its precise meaning or its part of speec
	Language	L.8.4.D	Verify the preliminary determination of the meaning of a word or phrase.
	Language	L.8.5	Demonstrate understanding of figurative language, word relationships, and nuances in word meanings.
	Language	L.8.5.A	Interpret figures of speech in context.
	Language	L.8.5.B	Use the relationship between particular words to better understand each of the words.
	Language	L.8.5.C	Distinguish among the connotations (associations) of words with similar denotations (definitions).
	Language	L.8.6	Acquire and use accurately grade-appropriate general academic and domain-specific words and phrases; gather vocabulary knowledge when considering a word or phrase important to comprehension or expression.
	Language	L.9.1	Demonstrate command of the conventions of standard English grammar and usage when writing or speaking.
	Language	L.9.1.A	Use parallel structure.
	Language	L.9.1.B	Use various types of phrases and clauses to convey specific meanings and add variety and interest to writing or presentations.
	Language	L.9.2	Demonstrate command of the conventions of standard English capitalization, punctuation, and spelling when writing.
